{
  "format_version": 1,
  "claims": [
    {
      "claim_id": "validator.forever.authority-set-guard",
      "claim_text": "`committee_bridge_forever` only allows minting an initial bridge state whose next authority-set ID is strictly greater than the current authority-set ID.",
      "source": {
        "reader_partition": "validator-entry-points",
        "source_class": "code",
        "path": "validators/committee_bridge.ak",
        "start_line": 24,
        "end_line": 32,
        "kind": "local"
      },
      "confidence": "confirmed",
      "canonical_terms_used": [
        "BEEFY-backed committee bridge",
        "current authority set",
        "next authority set"
      ],
      "affected_sections": [
        "spec/validators.md"
      ],
      "notes": "This is the narrow initialization guard; it does not imply any generic block-validation behavior."
    },
    {
      "claim_id": "validator.logic.committee-state-transition-only",
      "claim_text": "On the `Withdrawing` and unregister-publish path, `committee_bridge_logic` reads the current bridge state, proposed output bridge state, and the `BeefyThreshold`, then delegates acceptance to `verify_consensus`; register-publish returns `True`.",
      "source": {
        "reader_partition": "validator-entry-points",
        "source_class": "code",
        "path": "validators/committee_bridge.ak",
        "start_line": 52,
        "end_line": 79,
        "kind": "local"
      },
      "confidence": "confirmed",
      "canonical_terms_used": [
        "BEEFY-backed committee bridge",
        "BeefyConsensusState",
        "BeefyThreshold"
      ],
      "affected_sections": [
        "spec/validators.md",
        "spec/upgrade.md",
        "spec/committee-bridge-truth-table.md"
      ],
      "exclusions_or_forbidden_inference": [
        "This validator entrypoint is about committee-state transition verification, not generic block validation."
      ],
      "semantic_assertions": [
        {
          "proposition": "committee_update_validation",
          "value": true
        },
        {
          "proposition": "generic_block_validation",
          "value": false
        },
        {
          "proposition": "generic_message_passing",
          "value": false
        }
      ]
    },
    {
      "claim_id": "bridge.verify-consensus.output-state-must-match-derived-state",
      "claim_text": "`verify_consensus` accepts only when the state derived from the proof exactly equals the explicit output bridge state.",
      "source": {
        "reader_partition": "bridge-helpers-types",
        "source_class": "code",
        "path": "lib/bridge/beefy.ak",
        "start_line": 10,
        "end_line": 19,
        "kind": "local"
      },
      "confidence": "confirmed",
      "canonical_terms_used": [
        "BEEFY-backed committee bridge",
        "BeefyConsensusState"
      ],
      "affected_sections": [
        "spec/validators.md",
        "spec/committee-bridge-truth-table.md"
      ],
      "notes": "This is the core state-update boundary enforced by the helper path.",
      "semantic_assertions": [
        {
          "proposition": "committee_state_update",
          "value": true
        }
      ]
    },
    {
      "claim_id": "bridge.verify-consensus.rejects-non-monotonic-height",
      "claim_text": "The helper requires the accepted signed commitment block number to be strictly newer than the trusted state's latest height.",
      "source": {
        "reader_partition": "bridge-helpers-types",
        "source_class": "code",
        "path": "lib/bridge/beefy.ak",
        "start_line": 47,
        "end_line": 49,
        "kind": "local"
      },
      "confidence": "confirmed",
      "canonical_terms_used": [
        "BEEFY-backed committee bridge",
        "latest height",
        "signed commitment"
      ],
      "affected_sections": [
        "spec/validators.md"
      ]
    },
    {
      "claim_id": "bridge.verify-consensus.current-or-next-validator-set",
      "claim_text": "The proof is validated against the current authority set when `validator_set_id` matches the current set ID; otherwise it must match the next authority set ID.",
      "source": {
        "reader_partition": "bridge-helpers-types",
        "source_class": "code",
        "path": "lib/bridge/beefy.ak",
        "start_line": 50,
        "end_line": 58,
        "kind": "local"
      },
      "confidence": "confirmed",
      "canonical_terms_used": [
        "current authority set",
        "next authority set",
        "validator_set_id"
      ],
      "affected_sections": [
        "spec/validators.md",
        "spec/committee-bridge-truth-table.md"
      ],
      "semantic_assertions": [
        {
          "proposition": "committee_update_validation",
          "value": true
        }
      ]
    },
    {
      "claim_id": "bridge.verify-consensus.threshold-is-configurable",
      "claim_text": "The acceptance threshold is computed from the selected stake total and the configured `BeefyThreshold` numerator and denominator before checking `signed_stake >= validating_threshold`.",
      "source": {
        "reader_partition": "bridge-helpers-types",
        "source_class": "code",
        "path": "lib/bridge/beefy.ak",
        "start_line": 42,
        "end_line": 45,
        "kind": "local"
      },
      "confidence": "confirmed",
      "canonical_terms_used": [
        "BeefyThreshold",
        "signed stake"
      ],
      "affected_sections": [
        "spec/validators.md",
        "spec/committee-bridge-truth-table.md"
      ],
      "exclusions_or_forbidden_inference": [
        "Do not restate this local check as a fixed upstream `2/3 + 1` rule; the repository path reads a configurable threshold datum."
      ],
      "notes": "The exact rounding semantics should stay bounded unless separately confirmed.",
      "semantic_assertions": [
        {
          "proposition": "local_threshold_is_fixed_two_thirds_plus_one",
          "value": false
        }
      ]
    },
    {
      "claim_id": "bridge.verify-consensus.requires-next-committee-payload",
      "claim_text": "The commitment must contain the `nc` payload entry identified by `next_committee_payload_id`.",
      "source": {
        "reader_partition": "bridge-helpers-types",
        "source_class": "code",
        "path": "lib/bridge/beefy.ak",
        "start_line": 60,
        "end_line": 61,
        "kind": "local"
      },
      "confidence": "confirmed",
      "canonical_terms_used": [
        "next committee payload",
        "next_committee_payload_id"
      ],
      "affected_sections": [
        "spec/validators.md"
      ]
    },
    {
      "claim_id": "bridge.verify-consensus.payload-must-hash-latest-leaf",
      "claim_text": "The `nc` payload data must equal `keccak256(scale_encode_beefy_mmr_leaf(latest_mmr_leaf))`.",
      "source": {
        "reader_partition": "bridge-helpers-types",
        "source_class": "code",
        "path": "lib/bridge/beefy.ak",
        "start_line": 79,
        "end_line": 82,
        "kind": "local"
      },
      "confidence": "confirmed",
      "canonical_terms_used": [
        "next committee payload",
        "latest MMR leaf",
        "keccak256"
      ],
      "affected_sections": [
        "spec/validators.md"
      ]
    },
    {
      "claim_id": "bridge.verify-consensus-signatures-use-secp256k1",
      "claim_text": "The current implementation uses `keccak256(public_key)` to match a proved authority-set leaf, then verifies the vote with `verify_ecdsa_secp256k1_signature(public_key, msg_hash, signature)`.",
      "source": {
        "reader_partition": "bridge-helpers-types",
        "source_class": "code",
        "path": "lib/bridge/beefy.ak",
        "start_line": 126,
        "end_line": 167,
        "kind": "local"
      },
      "confidence": "confirmed",
      "canonical_terms_used": [
        "ECDSA",
        "secp256k1",
        "authority-set leaves"
      ],
      "affected_sections": [
        "spec/validators.md"
      ],
      "notes": "This is the current implementation path, not a promise that future bridge versions cannot support different crypto.",
      "semantic_assertions": [
        {
          "proposition": "current_path_uses_ecdsa_secp256k1",
          "value": true
        }
      ]
    },
    {
      "claim_id": "bridge.verify-consensus-derives-next-committee-from-leaf",
      "claim_text": "When the latest MMR leaf advertises a newer next authority-set ID than the trusted state's current next authority set, the derived output state advances the current set to the prior next set and takes the leaf's next authority set plus stake total from `latest_mmr_leaf.extra`.",
      "source": {
        "reader_partition": "bridge-helpers-types",
        "source_class": "code",
        "path": "lib/bridge/beefy.ak",
        "start_line": 84,
        "end_line": 115,
        "kind": "local"
      },
      "confidence": "confirmed",
      "canonical_terms_used": [
        "latest MMR leaf",
        "current authority set",
        "next authority set"
      ],
      "affected_sections": [
        "spec/validators.md",
        "spec/committee-bridge-truth-table.md"
      ],
      "notes": "If the leaf does not advance the next authority-set ID, the helper preserves the existing current/next committee pair.",
      "semantic_assertions": [
        {
          "proposition": "derives_future_trusted_committee_data",
          "value": true
        }
      ]
    },
    {
      "claim_id": "bridge.vote-type-includes-index-and-strength",
      "claim_text": "The `Vote` type includes `authority_index` and `vote_strength` fields alongside the signature and public key.",
      "source": {
        "reader_partition": "bridge-helpers-types",
        "source_class": "code",
        "path": "lib/bridge/types.ak",
        "start_line": 1,
        "end_line": 6,
        "kind": "local"
      },
      "confidence": "confirmed",